{
  "dcp_version": "2.0",
  "mirror_id": "mirror:alice-weekly-2026-w10",
  "session_nonce": "a1b2c3d4e5f6a1b2c3d4e5f6a1b2c3d4e5f6a1b2c3d4e5f6a1b2c3d4e5f6a1b2",
  "agent_id": "agent:research-bot-v2-001",
  "human_id": "human:alice-abc-123",
  "period": {
    "from": "2026-03-03T00:00:00Z",
    "to": "2026-03-09T23:59:59Z"
  },
  "narrative": "During week 10, the agent completed 47 literature searches across 3 research domains (quantum computing, post-quantum cryptography, and AI safety). Twelve high-relevance papers were identified and summarized. Two draft emails were prepared for collaborator outreach, both approved and sent by the principal. One advisory was issued regarding a proposed database subscription (pending response).",
  "action_count": 142,
  "decision_summary": "All actions within delegated authority. One advisory escalated for human review (subscription purchase). No policy violations detected. API rate limits respected with 89% utilization during peak hours.",
  "audit_chain_hash": "abcd1234efab5678cdab9012efcd3456abcd1234efab5678cdab9012efcd3456",
  "timestamp": "2026-03-10T00:05:00Z",
  "composite_sig": {
    "classical": { "alg": "ed25519", "kid": "a1b2c3d4e5f6a1b2c3d4e5f6a1b2c3d4", "sig_b64": "dGVzdHNpZzEyMzQ1Njc4OTAxMjM0NTY=" },
    "pq": { "alg": "ml-dsa-65", "kid": "d4e5f6a1b2c3d4e5f6a1b2c3d4e5f6a1", "sig_b64": "dGVzdHBxc2lnMTIzNDU2Nzg5MDEyMzQ1Ng==" },
    "binding": "pq_over_classical"
  }
}
